{
  "grant_id": "grant_parent",
  "issuer": "https://auth.example.com",
  "subject": {
    "type": "human",
    "issuer": "https://id.example.com",
    "id": "user_123"
  },
  "actor_agent_issuer": "https://agents.example.com",
  "actor_agent_id": "orchestrator",
  "purpose": "pay approved invoices",
  "capabilities": [
    {
      "capability_id": "cap_payment",
      "type": "agent_action",
      "action": "payment.create",
      "resources": [
        "urn:account:123",
        "urn:account:456"
      ],
      "arguments": {
        "amount": {
          "constraint_type": "range",
          "min": 0,
          "max": 500
        },
        "currency": {
          "constraint_type": "one_of",
          "values": [
            "USD",
            "EUR"
          ]
        }
      }
    }
  ],
  "not_before": "2026-10-05T12:00:00Z",
  "expires_at": "2026-10-06T12:00:00Z",
  "max_delegation_depth": 2,
  "status": "active"
}
